{
  "$schema": "http://json-schema.org/draft-07/schema#",
  "$id": "https://github.com/tokkiclient/toki/schemas/entity.json",
  "title": "ToKi Entity Definition",
  "description": "A reusable entity definition template for the ToKi game engine",
  "type": "object",
  "required": [
    "name",
    "display_name",
    "rendering",
    "solid",
    "active",
    "collision",
    "audio",
    "animations",
    "category"
  ],
  "properties": {
    "name": {
      "type": "string",
      "description": "Internal name/ID for the entity"
    },
    "display_name": {
      "type": "string",
      "description": "Human-readable name for the entity"
    },
    "description": {
      "type": "string",
      "description": "Description of the entity"
    },
    "rendering": {
      "$ref": "#/definitions/rendering"
    },
    "collision": {
      "$ref": "#/definitions/collision"
    },
    "audio": {
      "$ref": "#/definitions/audio"
    },
    "animations": {
      "$ref": "#/definitions/animations"
    },
    "category": {
      "type": "string",
      "description": "Generic category for organization and authoring (human, creature, building, item, etc.)"
    },
    "tags": {
      "type": "array",
      "items": {
        "type": "string"
      },
      "description": "Tags for filtering and searching"
    },
    "solid": {
      "type": "boolean",
      "description": "Whether entity blocks movement"
    },
    "active": {
      "type": "boolean",
      "description": "Whether entity is active by default"
    },
    "components": {
      "$ref": "#/definitions/components"
    }
  },
  "definitions": {
    "rendering": {
      "type": "object",
      "required": [
        "size",
        "render_layer",
        "visible"
      ],
      "properties": {
        "size": {
          "type": "array",
          "items": {
            "type": "integer",
            "minimum": 1
          },
          "minItems": 2,
          "maxItems": 2,
          "description": "Rendering size [width, height] in pixels"
        },
        "render_layer": {
          "type": "integer",
          "description": "Rendering layer (higher values render on top)"
        },
        "visible": {
          "type": "boolean",
          "description": "Whether entity is visible by default"
        },
        "static_object": {
          "type": [
            "object",
            "null"
          ],
          "description": "Optional object-sheet-backed static render source for entities without animation clips",
          "required": [
            "sheet",
            "object_name"
          ],
          "properties": {
            "sheet": {
              "type": "string",
              "minLength": 1
            },
            "object_name": {
              "type": "string",
              "minLength": 1
            }
          }
        }
      }
    },
    "collision": {
      "type": "object",
      "required": [
        "enabled",
        "offset",
        "size",
        "trigger"
      ],
      "properties": {
        "enabled": {
          "type": "boolean",
          "description": "Whether collision detection is enabled"
        },
        "offset": {
          "type": "array",
          "items": {
            "type": "integer"
          },
          "minItems": 2,
          "maxItems": 2,
          "description": "Collision box offset from entity center [x, y]"
        },
        "size": {
          "type": "array",
          "items": {
            "type": "integer",
            "minimum": 1
          },
          "minItems": 2,
          "maxItems": 2,
          "description": "Collision box size [width, height]"
        },
        "trigger": {
          "type": "boolean",
          "description": "Whether this is a trigger collision (doesn't block movement)"
        }
      }
    },
    "audio": {
      "type": "object",
      "required": [
        "footstep_trigger_distance"
      ],
      "properties": {
        "footstep_trigger_distance": {
          "type": "number",
          "minimum": 0,
          "description": "Distance entity must move to trigger footstep sound"
        },
        "movement_sound_trigger": {
          "type": "string",
          "enum": [
            "distance",
            "animation_loop"
          ],
          "description": "How movement sound timing is driven"
        },
        "movement_sound": {
          "type": [
            "string",
            "null"
          ],
          "description": "Sound ID to play when entity moves"
        },
        "collision_sound": {
          "type": [
            "string",
            "null"
          ],
          "description": "Sound ID to play when entity collides"
        }
      }
    },
    "animations": {
      "type": "object",
      "required": [
        "atlas_name",
        "clips",
        "default_state"
      ],
      "properties": {
        "atlas_name": {
          "type": "string",
          "description": "Name of the atlas containing animation frames"
        },
        "clips": {
          "type": "array",
          "items": {
            "$ref": "#/definitions/animationClip"
          },
          "description": "Array of animation clips"
        },
        "default_state": {
          "type": "string",
          "description": "Default animation state to start with"
        }
      }
    },
    "animationClip": {
      "type": "object",
      "required": [
        "state",
        "frame_tiles",
        "frame_duration_ms",
        "loop_mode"
      ],
      "properties": {
        "state": {
          "type": "string",
          "description": "Animation state name"
        },
        "frame_tiles": {
          "type": "array",
          "items": {
            "type": "string"
          },
          "minItems": 1,
          "description": "Array of tile names for animation frames"
        },
        "frame_duration_ms": {
          "type": "number",
          "minimum": 0,
          "description": "Duration of each frame in milliseconds"
        },
        "loop_mode": {
          "type": "string",
          "enum": [
            "loop",
            "once",
            "ping_pong"
          ],
          "description": "How the animation should loop"
        }
      }
    },
    "components": {
      "type": "object",
      "properties": {
        "movement": {
          "$ref": "#/definitions/movementComponent"
        },
        "ai": {
          "$ref": "#/definitions/aiComponent"
        },
        "interaction": {
          "$ref": "#/definitions/interactionComponent"
        },
        "combat": {
          "$ref": "#/definitions/combatComponent"
        },
        "primary_projectile": {
          "type": [
            "object",
            "null"
          ],
          "description": "Optional projectile spawned by the entity's primary action",
          "required": [
            "sheet",
            "object_name",
            "size",
            "speed",
            "damage",
            "lifetime_ticks"
          ],
          "properties": {
            "sheet": {
              "type": "string",
              "minLength": 1
            },
            "object_name": {
              "type": "string",
              "minLength": 1
            },
            "size": {
              "type": "array",
              "items": {
                "type": "integer",
                "minimum": 1
              },
              "minItems": 2,
              "maxItems": 2
            },
            "speed": {
              "type": "integer",
              "minimum": 0
            },
            "damage": {
              "type": "integer",
              "minimum": 0
            },
            "lifetime_ticks": {
              "type": "integer",
              "minimum": 1
            },
            "spawn_offset": {
              "type": "array",
              "items": {
                "type": "integer"
              },
              "minItems": 2,
              "maxItems": 2
            }
          }
        },
        "pickup": {
          "type": [
            "object",
            "null"
          ],
          "description": "Optional item stack granted when another entity collects this entity by overlap",
          "required": [
            "item_id",
            "count"
          ],
          "properties": {
            "item_id": {
              "type": "string",
              "minLength": 1
            },
            "count": {
              "type": "integer",
              "minimum": 1
            }
          }
        },
        "inventory": {
          "$ref": "#/definitions/inventoryComponent"
        }
      },
      "additionalProperties": false
    },
    "movementComponent": {
      "type": "object",
      "required": [
        "speed",
        "movement_profile",
        "can_move"
      ],
      "properties": {
        "speed": {
          "type": "number",
          "minimum": 0
        },
        "movement_profile": {
          "type": "string"
        },
        "can_move": {
          "type": "boolean"
        }
      },
      "additionalProperties": false
    },
    "aiComponent": {
      "type": "object",
      "required": [
        "ai_config"
      ],
      "properties": {
        "ai_config": {
          "type": "object",
          "required": [
            "behavior",
            "detection_radius"
          ],
          "properties": {
            "behavior": {
              "type": "string"
            },
            "detection_radius": {
              "type": "integer",
              "minimum": 0
            }
          },
          "additionalProperties": false
        }
      },
      "additionalProperties": false
    },
    "interactionComponent": {
      "type": "object",
      "required": [
        "interaction_reach"
      ],
      "properties": {
        "interaction_reach": {
          "type": "integer",
          "minimum": 0
        }
      },
      "additionalProperties": false
    },
    "combatComponent": {
      "type": "object",
      "properties": {
        "health": {
          "type": [
            "integer",
            "null"
          ],
          "minimum": 0
        },
        "stats": {
          "$ref": "#/definitions/entityStats"
        }
      },
      "additionalProperties": false
    },
    "entityStats": {
      "type": "object",
      "properties": {
        "base": {
          "type": "object",
          "propertyNames": {
            "type": "string",
            "minLength": 1
          },
          "additionalProperties": {
            "type": "integer",
            "minimum": 0
          }
        },
        "current": {
          "type": "object",
          "propertyNames": {
            "type": "string",
            "minLength": 1
          },
          "additionalProperties": {
            "type": "integer",
            "minimum": 0
          }
        }
      },
      "additionalProperties": false
    },
    "inventoryComponent": {
      "type": "object",
      "properties": {
        "items": {
          "type": "object",
          "propertyNames": {
            "type": "string",
            "minLength": 1
          },
          "additionalProperties": {
            "type": "integer",
            "minimum": 0
          }
        }
      },
      "additionalProperties": false
    }
  }
}
