{
  "name": "palette_guide",
  "display_name": "Night Guide",
  "description": "Indexed NPC using a per-definition palette override.",
  "rendering": {
    "size": [
      16,
      16
    ],
    "render_layer": 1,
    "visible": true,
    "has_shadow": true,
    "palette_override": "night"
  },
  "collision": {
    "enabled": false,
    "offset": [
      0,
      0
    ],
    "size": [
      16,
      16
    ],
    "trigger": false
  },
  "audio": {
    "footstep_trigger_distance": 16.0,
    "hearing_radius": 192,
    "movement_sound_trigger": "distance",
    "movement_sound": "",
    "collision_sound": null
  },
  "animations": {
    "atlas_name": "indexed_demo.json",
    "clips": [
      {
        "state": "idle",
        "frame_tiles": [
          "guide/idle"
        ],
        "frame_duration_ms": 300.0,
        "loop_mode": "loop"
      }
    ],
    "default_state": "idle"
  },
  "category": "palette_demo",
  "tags": [
    "palette_demo",
    "indexed_override"
  ],
  "solid": false,
  "active": true,
  "components": {
    "movement": {
      "speed": 0.0,
      "movement_profile": "none",
      "can_move": false
    },
    "combat": {
      "health": 10,
      "stats": {
        "base": {
          "health": 10
        },
        "current": {
          "health": 10
        }
      }
    }
  }
}
