{
  "name": "villager",
  "display_name": "Villager",
  "description": "A stationary villager for the top-down starter scene.",
  "rendering": {
    "size": [
      16,
      16
    ],
    "render_layer": 2,
    "visible": true
  },
  "collision": {
    "enabled": true,
    "offset": [
      0,
      0
    ],
    "size": [
      16,
      16
    ],
    "trigger": false
  },
  "audio": {
    "footstep_trigger_distance": 24.0,
    "movement_sound": "",
    "collision_sound": null
  },
  "animations": {
    "atlas_name": "creatures.json",
    "clips": [
      {
        "state": "idle",
        "frame_tiles": [
          "villager/idle_0",
          "villager/idle_1"
        ],
        "frame_duration_ms": 320.0,
        "loop_mode": "loop"
      },
      {
        "state": "walk",
        "frame_tiles": [
          "villager/walk_0",
          "villager/walk_1",
          "villager/walk_2",
          "villager/walk_3"
        ],
        "frame_duration_ms": 180.0,
        "loop_mode": "loop"
      }
    ],
    "default_state": "idle"
  },
  "category": "human",
  "tags": [
    "npc",
    "starter",
    "town"
  ],
  "solid": true,
  "active": true,
  "components": {
    "movement": {
      "speed": 1,
      "movement_profile": "legacy_default",
      "can_move": false
    },
    "combat": {
      "health": 10,
      "stats": {
        "base": {
          "health": 10
        },
        "current": {
          "health": 10
        }
      }
    }
  }
}
