{
  "name": "player",
  "display_name": "Player",
  "description": "The controllable hero for the top-down starter template.",
  "rendering": {
    "size": [
      16,
      16
    ],
    "render_layer": 2,
    "visible": true
  },
  "collision": {
    "enabled": true,
    "offset": [
      0,
      0
    ],
    "size": [
      16,
      16
    ],
    "trigger": false
  },
  "audio": {
    "footstep_trigger_distance": 24.0,
    "movement_sound": "",
    "collision_sound": null
  },
  "animations": {
    "atlas_name": "creatures.json",
    "clips": [
      {
        "state": "idle",
        "frame_tiles": [
          "player/idle_0",
          "player/idle_1"
        ],
        "frame_duration_ms": 260.0,
        "loop_mode": "loop"
      },
      {
        "state": "walk",
        "frame_tiles": [
          "player/walk_0",
          "player/walk_1",
          "player/walk_2",
          "player/walk_3"
        ],
        "frame_duration_ms": 140.0,
        "loop_mode": "loop"
      }
    ],
    "default_state": "idle"
  },
  "category": "human",
  "tags": [
    "player",
    "starter",
    "hero"
  ],
  "solid": true,
  "active": true,
  "components": {
    "movement": {
      "speed": 2,
      "movement_profile": "player_wasd",
      "can_move": true
    },
    "combat": {
      "health": 100,
      "stats": {
        "base": {
          "health": 100
        },
        "current": {
          "health": 100
        }
      }
    },
    "inventory": {}
  }
}
